id,title,selftext,score,num_comments,author,created_utc,url,upvote_ratio,over_18,edited,spoiler,stickied
1945s14,Guess the data type ಠ_ಠ,,516,48,Thinker_Assignment,2024-01-11 16:31:27,https://i.redd.it/t9nn0bq88ubc1.png,0,False,False,False,False
198kif0,"My company just put out 3 data engineering jobs last year, guess who we got?","As per title, my company put out 3 entry level data engineer jobs last year. The pay range was terrible, 60 - 80k. 

We ended up hiring a data engineer with 3 yoe at a Fortune 100, a data engineer with 1 yoe and a masters in machine learning, and a self taught engineer who has built applications that literally make my applications look like children's books. 

They've jumped on projects with some of our previous entry level hires from 2019-2022 and made them look like chumps. 

All of them were looking for jobs for at least 4-6 months. 

Just wanted to share a data point on the state of the market last year in 2023. 

Funny thing is that I don't expect any of them to stay when the job market picks up, and we may have a mass exodus on our hands. ",513,109,Justanotherguy2022,2024-01-17 01:44:50,https://www.reddit.com/r/dataengineering/comments/198kif0/my_company_just_put_out_3_data_engineering_jobs/,0,False,False,False,False
19bg4jf,I’m releasing a free data engineering boot camp in March,"Meeting 2 days per week for an hour each. 

Right now I’m thinking: 

- one week of SQL
- one week of Python (focusing on REST APIs too) 
- one week of Snowflake 
- one week of orchestration with Airflow
- one week of data quality 
- one week of communication and soft skills 

What other topics should be covered and/or removed? I want to keep it time boxed to 6 weeks. 

What other things should I consider when launching this? 

If you make a free account at dataexpert.io/signup you can get access once the boot camp launches. 

Thanks for your feedback in advance!",341,174,eczachly,2024-01-20 16:55:10,https://www.reddit.com/r/dataengineering/comments/19bg4jf/im_releasing_a_free_data_engineering_boot_camp_in/,0,False,False,False,False
18xj97r,Why does nothing ever get used?,"Dashboards, views, tables, pipelines, entire data marts. Why does 90% of the work I do never get used?   

I used to be one of the best BA's in my entire company so I am very good at requirements gathering and understanding what the business is trying to accomplish. Most of the work that I get comes from the CEO/VP level (global corporation not startup so real CEO and real VP 's) so a lot of people seem like they are very invested in solving these problems and my work always gets rave reviews.....but once things go into prod they basically never get touched.  

Six months ago I just.... stopped doing QA.. I have been relying on the ""scream test"", I mark tickets resolved and immediately move to prod and only do QA if someone screams that something is wrong. I have yet to hear back on anything.",253,66,None,2024-01-03 13:20:50,https://www.reddit.com/r/dataengineering/comments/18xj97r/why_does_nothing_ever_get_used/,0,False,False,False,False
19f9dba,"Well guys, this is the end",🥹,234,127,marclamberti,2024-01-25 13:30:21,https://i.redd.it/mnp1r3m49lec1.jpeg,0,False,False,False,False
199fg7g,Did I get bamboozled into a data engineering job?,"I'm coming up on 1.5 YoE at my job where my title is ""data analyst"". This is my first real job and I got it out of college. Up until today, I assumed that I was a data analyst doing data analysty things and building a career in data analytics. However, since finding out that data engineering is a separate thing, I've started to suspect that I may actually be working in an entry-level data engineering role.

The job description asked for mastery of Tableau and proficiency in Python. Since starting, I've used Python for scripting a fair amount, but have used Tableau EDA a grand total of zero times. They trained me up in Alteryx, an ETL tool, and now my work mainly consists of Alteryx, SQL, and Python.

90% of my work is building automated data pipelines for other teams; they come to us with some process that they're doing manually in Excel and we make it automatic for them. We follow an Agile framework, gather requirements, build and test, deploy and support. Our typical end product is an app that another team uses, not a dashboard.

Am I actually a trainee data engineer? ",209,58,WarCrimeWizard,2024-01-18 02:43:48,https://www.reddit.com/r/dataengineering/comments/199fg7g/did_i_get_bamboozled_into_a_data_engineering_job/,0,False,False,False,False
19c2ftl,Some Data Scientists write bad Python code and are stubborn in code reviews,"My first job title in tech was Data Scientist, now I'm officially a Data Engineer, but working somewhere in Data Science/Engineering, MLOps and as a Python Dev.

I'm not claiming to be a good programmer with two and a half years of professional experience, but I think some of our Data Scientists write bad Python code.  


Here I explain why:

* Using generic execptions instead of thinking about what error they really want to catch
* They try to encapsulate all functions as static methods in classes, even though it's okay to use free standing functions sometimes
* They don't use enums (or don't know what enums are used for)
* Sometimes they use bad method names -> they think `da_file2tbl_file()` is better than `convert_data_asset_to_mltalble()` (What do you think is better?)
* Overengineering: Use of design patterns with 70 lines of code, although one simple free-standing function with 10 lines would have sufficed (-> but I respect the fact that an effort is made here to learn and try out new things)
* Use of global variables, although this could easily have been solved with an instance variable or a parameter extension in the method header
* Too many useless and redundant comments like:  
`# Creating dataframe`  
`df = pd.DataFrame(...)`
* Use of magic strings/numbers instead of constants
* etc ...

What are your experiences with Data Scientists or Data Engineers using Python?

I don't despise anyone who makes such mistakes, but what's bad is that some Data Scientists are stubborn and say in code reviews: ""But I want to encapsulate all functions as static methods in a class or ""I think my 70-line design pattern is better than your 10-code-line function"" or ""I'd rather use global variables. I don't want to rewrite the code now."" I find that very annoying. Some people have too big an ego. But code reviews aren't about being the smartest in the room, they're about learning from each other and making the product better.  


Last year I started learning more programming languages. Kotlin and Rust.  I'm working on a personal project in Kotlin to rebuild our machine learning infrastructure and I'm still at tutorial level with Rust.  Both languages are amazing so far and both have already helped me to be a better (Python) programmer. What is your experience? Do you also think that learning more (statically typed) languages makes you a better developer? ",181,132,noisescience,2024-01-21 12:31:19,https://www.reddit.com/r/dataengineering/comments/19c2ftl/some_data_scientists_write_bad_python_code_and/,0,False,False,False,False
18wnsqj,Data Testing Cheat Sheet: 12 Essential Rules," 

1. **Source vs Target Data Reconciliation:** Ensure correct loading of customer data from source to target. Verify row count, data match, and correct filtering.
2. **ETL Transformation Test:** Validate the accuracy of data transformation in the ETL process. Examples include matching transaction quantities and amounts.
3. **Source Data Validation:** Validate the validity of data in the source file. Check for conditions like NULL names and correct date formats.
4. **Business Validation Rule:** Validate data against business rules independently of ETL processes. Example: Audit Net Amount - Gross Amount - (Commissions + taxes + fees).
5. **Business Reconciliation Rule:** Ensure consistency and reconciliation between two business areas. Example: Check for shipments without corresponding orders.
6. **Referential Integrity Reconciliation:** Audit the reconciliation between factual and reference data. Example: Monitor referential integrity within or between databases.
7. **Data Migration Reconciliation:** Reconcile data between old and new systems during migration. Verify twice: after initialization and post-triggering the same process.
8. **Physical Schema Reconciliation:** Ensure the physical schema consistency between systems. Useful during releases to sync QA & production environments.
9. **Cross Source Data Reconciliation:** Audit if data between different source systems is within accepted tolerance. Example: Check if ratings for the same product align within tolerance.
10. **BI Report Validation:** Validate correctness of data on BI dashboards based on rules. Example: Ensure sales amount is not zero on the sales BI report.
11. **BI Report Reconciliation:** Reconcile data between BI reports and databases or files. Example: Compare total products by category between report and source database.
12. **BI Report Cross-Environment Reconciliation:** Audit if BI reports in different environments match. Example: Compare BI reports in UAT and production environments.

[Data Testing Cheat Sheet](https://preview.redd.it/mknzrwbvn0ac1.png?width=1887&format=png&auto=webp&s=f9023dd75ddde8a5f4355eec6e0d0be08c836e48)",178,10,icedqengineer,2024-01-02 11:59:27,https://www.reddit.com/r/dataengineering/comments/18wnsqj/data_testing_cheat_sheet_12_essential_rules/,0,False,False,False,False
197t8fz,"Apache Iceberg: SQL and ACID semantics in the front, scalable object storage in the back",,176,27,bitsondatadev,2024-01-16 03:52:52,https://i.redd.it/731s003m5qcc1.jpeg,0,False,False,False,False
1913k8k,Who are the GOATS of DE?,"This can a subjective question, DE is still niche and there is no such thing as a ranking but wanted to know if you guys have a high role model in the area. 

For example in programming there are well respected names on the likes of Linus Torvald or Guido Van Rossum.

This can be any inspiring youtuber, book writer, DE influencer or whatever.",140,116,hot-bulbasur,2024-01-07 21:46:35,https://www.reddit.com/r/dataengineering/comments/1913k8k/who_are_the_goats_of_de/,0,False,False,False,False
1abmrzv,"yes, I really said it",,271,72,Awkward-Cupcake6219,2024-01-26 16:45:56,https://i.redd.it/8jacgiphctec1.jpeg,0,False,False,False,False
19difxp,Is the Data Space really this Complicated or am I just overthinking?,"For some reason, everytime I try to learn I see new tools and how they ease the existing work. And I end up wasting more time where if I spent that on actually learning, I would be way ahead. How do you know which tool to pick and choose(from the noise in the market) ?

https://preview.redd.it/ji5thy5f05ec1.png?width=2013&format=png&auto=webp&s=167f4e2afce621cc135d5a0ff7d5c484fedaa032",108,88,_areebpasha,2024-01-23 06:55:02,https://www.reddit.com/r/dataengineering/comments/19difxp/is_the_data_space_really_this_complicated_or_am_i/,0,False,False,False,False
19cak0s,what is it that you do for work again?,"&#x200B;

https://i.redd.it/zhg215lraudc1.gif",104,26,mesirmysir,2024-01-21 18:51:36,https://www.reddit.com/r/dataengineering/comments/19cak0s/what_is_it_that_you_do_for_work_again/,0,False,False,False,False
1935ykj,Reality check: How good are you at the skills in your tech stack?,"So let's start by saying this is by no means a post to complain but just to get a reality check and understand what you guys mean when you name a technology in your tech stack. I was navigating the sub and found the posts like the salary discussion or newbies asking for help, and you've got the usual comments throwing around a bunch of technologies like it's fresh water. Oh sure just learn aws, sql, python, powerbi, airflow, terraform and docker and you're good to go, took me a year. Obviously started questioning if I'm dumb since I've been at this job 4 years and I'm currently mastering SQL after spending 3 years on PowerBI only

So I want to understand when you name these tools and put them in your tech stack, how good are you actually at this and how much is it just ""I understand the basics and I can Google/ChatGPT the rest"" ?

Let's take SQL for example. There's a huge difference between ""Udemy course"" level of knowledge (you got the basic idea, can use SQL up to subqueries and Window Functions) and that one colleague that can write 1000+ lines of stored procedure from scratch and model JSON into tables level of knowledge. Or PowerBI: again there's a difference between ""I can drag and drop objects on the canvas and create a visualization, yaay let me add it to the CV"" and having read The definitive guide to DAX 700+ pages on PowerBI's programming language, understanding how Vertipaq engine works internally and so on. You might say it is overkill to invest that much time in one single tech but that's another topic I don't want to tackle now.

For example, I don't use Python daily at my job, but I can do some stuff with it with the help of Google and Chatgpt. I know the basics of programming, I've done a couple Udemy courses out of curiosity, I know what sets and dictionaries are, I can query an API, do some stuff with the common libraries for data manipulation and return the data. If I have to touch a Python script written by another DEV to modify something specific, I can do that. But I don't have profound knowledge of the internals, I wouldn't know how to optimize code, I probably couldn't do heavy tasks on Python-built infrastructure unless the task was very clear or build something enterprise-level from scratch myself. Do you think I should name Python in my tech stack? Is this an acceptable level of knowledge for you to name in the tech stack? 

So yeah I just need to know what's the idea of this sub on this topic because there's one of two possible outcomes:

1. I'm studying in the wrong way, and it's taking me a lot more than a normal person to really understand these tools
2. I am underselling myself and suffering from imposter syndrome or something like that

Cheers ",101,74,schizo_coder,2024-01-10 11:15:25,https://www.reddit.com/r/dataengineering/comments/1935ykj/reality_check_how_good_are_you_at_the_skills_in/,0,False,False,False,False
19501yg,My whole team hates DLTs and I don't blame them.,"We have been using databricks(aws) close to a year now and have started working with DLTs \[Delta Live Tables\]. I personally don't hate them as much as my teammates but I don't blame them, a lot of DLT limitations are in direct contradiction with the Databricks vision. Reasons listed below:

* You have to be on shared compute, this complicates reading data and writing back out to s3 if you need to drop a file (need to be in single user mode)
* BIGGEST COMPLAINT: You cannot ""hop"" catalogs or even schemas. This is so weird to me. They are rolling out DLT and UC \[Unity Catalog\] and are pushing customers hard on both, but DLTs directly contradict the medallion architecture. You want to have data land in a bronze catalog, then move it to a silver, gold, etc. Great, create a pipeline for each and kill your job runtime because you now have to spin up 3 different computes. They had a private preview that allowed you to write to multiple schemas but they killed it. Why?
* DLTs have to run from workspace notebooks, because GIT providers can only point to a users specific repo, not a config'd repo and branch like a notebook job. Luckily we have DABs to control our deployment and skirt this issue but it seems so odd to us. The DLT documentation recommends setting up a repo per pipeline, thats insane!
* Cannot share compute across multiple pipelines. To my second point, the limitation of not being able to hop schemas/catalogs wouldn't matter if I could specify DLT compute to use in the three pipelines processing the data. That solves a huge problem.
* Documentation, community support is still weak.

I do love the automation DLT brings with ingesting data, specifically CDC data. But there are some pain-points that make absolutely no sense. I think Databricks is doing too much too fast and needs to refocus on what they were initially, a data platform that provided one place to do everything.",94,62,DataDoyle,2024-01-12 17:06:52,https://www.reddit.com/r/dataengineering/comments/19501yg/my_whole_team_hates_dlts_and_i_dont_blame_them/,0,False,False,False,False
1905tj2,Which tools are worth learning for an aspiring data engineer?,"I'm currently working as a data analyst, but in the near future I'd like to move into a more technical role and delve into data engineering. 

At the moment, I have quite good knowledge of Python and SQL as I work with these languages in my day-to-day job. I also have basic knowledge of general database concepts like normalisation/views/stored procedures etc.

But even looking at the entry-level job descriptions, I feel that I'm still a long way from getting a data engineering job, because the amount of tools required is insane.

And my question is, which of these tools are actually worth my time to learn? For example, are SQL Server tools like SSIS/SSAS important for data engineering? Or is it better to learn some cloud computing concepts? Or maybe something else?",95,41,Mokebe13,2024-01-06 18:01:08,https://www.reddit.com/r/dataengineering/comments/1905tj2/which_tools_are_worth_learning_for_an_aspiring/,0,False,False,False,False
18tjgp8,Zendesk Moves from DynamoDB to MySQL and S3 to Save over 80% in Costs,,91,11,rgancarz,2023-12-29 09:43:54,https://www.infoq.com/news/2023/12/zendesk-dynamodb-mysql-s3-cost/,0,False,False,False,False
18x2214,Optimizing a One Billion Row Challenge in with Rust and Python with Polars,"I posted this on /rust and I thought /dataengineering might find it interesting! 

I saw this [Blog Post](https://www.morling.dev/blog/one-billion-row-challenge/) on a Billion Row challenge for Java so naturally I tried implementing a solution in Rust using mainly polars.[Code/Gist here](https://gist.github.com/Butch78/702944427d78da6727a277e1f54d65c8)

Running the code on my laptop, which is equipped with an i7-1185G7 @ 3.00GHz and 32GB of RAM, but it is limited to 16GB of RAM because I developed in a Dev Container.  Using Polars I was able to get a solution that only takes around 39 seconds.


|Implementation|Time|Code/Gist Link|
|:-|:-|:-|
|Rust + Polars|39s|[https://gist.github.com/Butch78/702944427d78da6727a277e1f54d65c8](https://gist.github.com/Butch78/702944427d78da6727a277e1f54d65c8)|
|Rust STD Libray|19s|[Coriolinus Solution](https://github.com/coriolinus/1brc)|
|Python + Polars|61.41 sec|[https://github.com/Butch78/1BillionRowChallenge/blob/main/python\_1brc/main.py](https://github.com/Butch78/1BillionRowChallenge/blob/main/python_1brc/main.py)|
|Java [royvanrijn](https://github.com/gunnarmorling/1brc/blob/main/calculate_average_royvanrijn.sh)'s Solution | 23.366sec on the (8 core, 32 GB RAM) |[https://github.com/gunnarmorling/1brc/blob/main/calculate\_average\_royvanrijn.sh](https://github.com/gunnarmorling/1brc/blob/main/calculate_average_royvanrijn.sh)|

Thanks to @[coriolinus](https://www.reddit.com/user/coriolinus/) and his code, I was able to get a better implementation with the Rust STD library implementation.  Also thanks to @[ritchie46](https://www.reddit.com/user/ritchie46/) for the Polars recommendations and the great library!",87,29,matt78whoop,2024-01-02 22:13:42,https://www.reddit.com/r/dataengineering/comments/18x2214/optimizing_a_one_billion_row_challenge_in_with/,0,False,False,False,False
1904k5j,DBT Testing for Lazy People: dbt-testgen,"[dbt-testgen](https://github.com/kgmcquate/dbt-testgen) is an open-source DBT package (maintained by me) that generates tests for your DBT models based on real data.

Tests and data quality checks are often skipped because of the time and energy required to write them. This DBT package is designed to save you that time.

Currently supports Snowflake, Databricks, RedShift, BigQuery, Postgres, and DuckDB, with test coverage for all 6.

Check out the examples on the GitHub page: [https://github.com/kgmcquate/dbt-testgen](https://github.com/kgmcquate/dbt-testgen). I'm looking for ideas, feedback, and contributors. Thanks all :)",83,23,fuzzh3d,2024-01-06 17:07:47,https://www.reddit.com/r/dataengineering/comments/1904k5j/dbt_testing_for_lazy_people_dbttestgen/,1,False,False,False,False
18vdch8,Should I be offended? Project manager send me a code from Chatgpt,"I'm working on multiple things at the same time and last week a PM added some tasks and was pushy about it but other priorities are taking place, all the sudden he emails me a python code and asked me just to schedule it. I don't know how to react to this situation, and the code he sent is flawless, I'm at the point that I feel I can easily get replaced. Wanted to vent out with fellow DEs. What would you do if you were in my position?",77,116,Zack-s21,2023-12-31 18:05:45,https://www.reddit.com/r/dataengineering/comments/18vdch8/should_i_be_offended_project_manager_send_me_a/,0,False,False,False,False
19aty1m,Data Engineer offer retracted after I moved cities.,"Hey everyone,

I don't know if this is the right place to post this but I finally landed a data engineering job after being a dashboard jockey for 4-5 years. It was everything I had dreamt of. I was due to start in two days and I find out that the company retracted the offer due to a massive layoff.
I moved to Toronto, Canada and  put down a deposit for a rental, and basically spent a lot of time, energy and effort.
Is there anything I can expect from the company? Should I go back to looking for data analyst roles?
Just a rant, any advice would be awesome.

Thanks!",81,17,gruntywolf,2024-01-19 21:13:48,https://www.reddit.com/r/dataengineering/comments/19aty1m/data_engineer_offer_retracted_after_i_moved_cities/,0,False,False,False,False
18xb4ug,None of what I learned is a job requirement. I am essentially skill-less.,"Hi there, here's an example job requirements I just found (shortened it), which has the same feel as the last 50 job adverts I've seen recently.

""Proficiency in Bash, Python, and SQL. Experience with Linux and Docker. Knowledge in Databases, Data Modeling, ETL, dbt, and Snowflake. Expertise in Spark, Databricks, EMR, Streaming, and Kafka. Familiarity with AWS services such as EC2, S3, Lambda, EMR, Glue, and Athena.""

So.. I'm about to graduate from a Master's in Data Science, where I took mostly Data Engineering stuff for my optional units. Literally all I have had is some exposure to Bash, Python and SQL, and data types. The only reason why I know Linux and Docker is because I started writing something on a Raspberry Pi to open my garage door when I was 16, with a few other small projects.

Yes the master's teaches lots of stats, modelling concepts, ML, DL, and some Data Warehousing etc.. but not a single job, not even entry position that I have found, require skills I learned in my Master's. Every student in my class is now great at R but useless in Python, literally never see job adverts with R on it. Feels like the Master's was a Bachelor's or an ""Intro to Data Literacy"" course.

Where do you even learn these skills? I doubt that you guys just bullshit-apply to jobs and watch YouTube before the interview.. Should I take a full year OFF after my Master's to just learn everything about Azure, Google Cloud, Microsoft Analytics, bloody software development practices even and empty all the Udemy/Coursera courses out there? Then maybe I can get a job?

Gee. I feel like uni has absolutely not made me job ready in any way.",77,55,Zomdou,2024-01-03 05:06:32,https://www.reddit.com/r/dataengineering/comments/18xb4ug/none_of_what_i_learned_is_a_job_requirement_i_am/,0,False,False,False,False
194d07l,"Data Engineer - What's the best course, certification or degree of all time?","Hello guys,

I hope you guys are well. I'm curious about your opinions. I'm a data engineer trainee. I want to learn A LOT. Not only SQL, Python, but PySpak, etc, etc.

But I'm curious: What's the best course, or certification (specialization) or degree of all time for you, that you can end the course and say: ""Wow, f\*\*\*\*\*\* hell! This was amazing! I learned so much with this!""

I want to know your opinions :)

You can also share books, share what really help you with to grow as a Data Engineer and as a professional :)

Have a good day/night",74,59,GigabyteWarrior,2024-01-11 21:28:02,https://www.reddit.com/r/dataengineering/comments/194d07l/data_engineer_whats_the_best_course_certification/,0,False,False,False,False
18zfz14,Preparing for DE Interviews at FAANG+ companies,"I will try not to dox myself but the end goal for me is to end up as a Senior DE at a large tech company. At the moment I'm ambivalent on whether this results in Data Platform Engineering or Data Analytics Engineering.

Here is my general framework for studying:

1. LC Easy/Medium (Arrays & Hashing, Two Pointers, Sliding Window, Stack, Binary Search, try to solve in 20-25 minutes with no/minimal help)
2. SQL Medium/Hard (Try to solve in 3-5 minutes with no/minimal help)
3. Data Modeling (Identify business needs using Product Sense and create a Star/Snowflake schema from this)
4. Behavioral (standard STAR answers)

I am decidedly not good at algorithmic questions, which is part of the reason why I transitioned to DE (also I think it's cooler, among other things). Is this a good framework to abide by to target dedicated DE roles at FAANG+ companies (I specifically have Meta and Amazon in mind)? Any comments or insight would be welcomed.",74,25,KingTyranitar,2024-01-05 19:59:59,https://www.reddit.com/r/dataengineering/comments/18zfz14/preparing_for_de_interviews_at_faang_companies/,0,False,False,False,False
