id,title,selftext,score,num_comments,author,created_utc,url,upvote_ratio,over_18,edited,spoiler,stickied
195txyv,Using Databricks for Data Science/ML and Snowflake for Data Warehousing,"I've noticed people say on some old Reddit posts that certain companies use Databricks for their Bronze and Silver data layers, and then transfer this data into Snowflake for the Gold layer.

In such scenarios, as Data Engineers, we often need to reconnect to Snowflake from Databricks to retrieve data—sometimes a significant amount, depending on the table sizes and number of tables. This step is crucial when we have substantial data from sources not integrated into the data warehouse, as it allows us to enrich this data with warehouse data to create specialized datasets for data scientists' ML models.

Considering the use of both platforms, wouldn't it be more logical to fully establish the data warehouse in Snowflake and only transfer data into Databricks when necessary for creating these specialized, enriched datasets for data science and ML models?

I’m not familiar with the cost implications of these options, but I assume the latter approach might be more practical and efficient, especially for companies whose data warehouse teams have limited proficiency in Python.",12,23,khaili109,2024-01-13 18:02:48,https://www.reddit.com/r/dataengineering/comments/195txyv/using_databricks_for_data_scienceml_and_snowflake/,0,False,False,False,False
194gh3f,Data Warehouses vs Data Lakes,,11,5,danipudani,2024-01-11 23:50:49,https://youtu.be/xbtK43WlkMs?si=RR_Kn6e_4DuIbf9u,0,False,False,False,False
193eced,Why should I use Great Expectations if I already have tests in DBT?,"I hear Great Expectations (GX) banded about a lot on forum posts and from Medium articles etc.
 

I understand that it's a data quality tool, but so far I don't really understand why I would use it over just writing tests for my DBT models? I think maybe some of the examples I've seen are just too trivial to do GX justice?


To give you an idea of my current ""data engineering"" role (because as we know it's a vast space) I'm using Meltano to connect a bunch of app databases and third party sources to a warehouse then using DBT to create models for either analytics or dashboards. More of the time I'm doing backend and infra/kubernetes work.


I'd love to hear your thoughts and use cases!",10,9,trhyst,2024-01-10 17:52:19,https://www.reddit.com/r/dataengineering/comments/193eced/why_should_i_use_great_expectations_if_i_already/,0,False,False,False,False
1903dvu,Google's Professional Data Engineer Certification exam,"Hello! I'm going to take the exam soon. Any recommendations? Will getting the Udemy exam samples still worth it? Or are there other materials i should use?

Thank you!",11,17,No_Ice_5035,2024-01-06 16:15:34,https://www.reddit.com/r/dataengineering/comments/1903dvu/googles_professional_data_engineer_certification/,0,False,False,False,False
18zckja,Job Security,"Catch up to speed: Summer of 2023 Friend of mine told me to look into DE work as a career switch since I am already doing excel monkey work as an DA. Next 6 months I teach my self SQL, beginner Python and pass 2 Microsoft azure DE certs.

Currently applying to DE jobs and most of the jobs I am seeing seem to be like from consulting/contracting gigs. Are these legit in terms of job security? 

I would be leaving my current industry which is defense (think Lockheed or Boeing)  which I guess felt so “secure” because of all the govt fund we receive.

TLDR: does anybody here work DE for a consulting/contracting gig, how’s the job security? 

Bonus question : if you don’t work in consulting/contracting, what industry are you in and how’s the job security? Thanks",11,15,PoloParachutes,2024-01-05 17:38:09,https://www.reddit.com/r/dataengineering/comments/18zckja/job_security/,0,False,False,False,False
18ye6ve,Video: How to Setup a Nessie/Dremio Lakehouse on your Laptop in under 10 Minutes,,13,1,AMDataLake,2024-01-04 14:16:21,https://v.redd.it/w1z2r1i4mfac1,0,False,False,False,False
18x3ygn,Python over Stored Procedure in DE?,"I`m used to work with SP whenever I am etl`ing from database to database. I only use python when I need to work with csv, an pai, Json.

But I think I rear about using python and learning python (for begginers mainly) too much.

Does It makes Sense to work with python instead of PS on a database to database ETL? We are talking about stg to dw workloads for example. Is ir fazer? Secure? Or anything that advocates pro python?",12,23,DesperateBus362,2024-01-02 23:32:15,https://www.reddit.com/r/dataengineering/comments/18x3ygn/python_over_stored_procedure_in_de/,0,False,False,False,False
19ezf7p,Where does Prefect stand in terms of maturity?,"With Prefect self hosted, would you put production pipelines on it? How about if they were mission critical, would you trust Prefect with the job?

Would you invest the effort into making your prefect workers highly scalable compute monsters, or just stick with Airflow?

If not, what usually indicates that a platform is ready for this kind of workload?",12,3,DuckDatum,2024-01-25 03:10:24,https://www.reddit.com/r/dataengineering/comments/19ezf7p/where_does_prefect_stand_in_terms_of_maturity/,1,False,False,False,False
19ef60x,Mac book pro or gaming laptop for programming ?,Hey guys ! Just want your opinion on which one to buy. I work as both a data scientist as well as a data engineer and develop deep learning models as well host databases. Which laptop would you guys recommend. Price is not much of an issue but your opinions would help a lot 🙏🏻.,11,56,Automatic_Will_5137,2024-01-24 11:40:44,https://www.reddit.com/r/dataengineering/comments/19ef60x/mac_book_pro_or_gaming_laptop_for_programming/,0,False,False,False,False
19ckixd,need to implement code standards and do code reviews,"I am looking to learn to implement coding standards and eventually do code reviews. This is something new in the organization.

I don’t know where to begin. I need help in getting started and eventually understand the optimal/gold standard to reach. I understand reaching the optimal level would be a journey but want to have that in mind.

Can you pls guide on books/blogs anything on how to begin and what all happens in this ?",12,7,educationruinedme1,2024-01-22 02:08:44,https://www.reddit.com/r/dataengineering/comments/19ckixd/need_to_implement_code_standards_and_do_code/,1,False,False,False,False
19atnb7,Friday thread: what's your best I-did-the-analysis-and-then-management-ignored-it story?,"I'll start: I was once consulting for a company trying to land a multimillion dollar contract. The contract hinged on the company being able to save their customer a certain amount of money, based on projections and analysis from the customer's internal operational data.

When I did the analysis, the projected savings came up short, but my client was desperate to land the contract, so they pulled in a different analyst (somebody working full-time for the company.) His projections used slightly different methods and assumptions, but they still came out pretty close to mine.

So the CEO made the poor guy work overnight to do the analysis again, from scratch. This time, the numbers hit the target for projected savings, so that's what went in the pitch slides for the customer.

The crazy thing was that the contract was written so that my client would only get paid if they \*actually\* saved the customer money, so fudging things up front would only land the sale---it was still possible for the company to make no profit (or even lose money) on the deal.",12,7,abegong,2024-01-19 21:01:08,https://www.reddit.com/r/dataengineering/comments/19atnb7/friday_thread_whats_your_best/,0,False,False,False,False
19akgnq,BigQuery Column level lineage using ZetaSQL,"A long time ago, I built a BigQuery SQL parser for column lineage using ZetaSQL... and it's only fair to make it available and ready to be used:

[https://github.com/borjavb/bq-lineage-tool](https://github.com/borjavb/bq-lineage-tool)

It pretty much covers the whole BigQuery syntax, and tested over more than 5000 SQL queries:

* It's schema aware. This means that a query like SELECT \* FROM table will generate a DAG with all the output columns of table, and not just a single node with a \* symbol.
* It prunes unused columns. This means that for a query like WITH base AS (SELECT \* FROM table) SELECT aColumn FROM base  the output DAG will only contain the column aColumnand not the whole input table.
* UNNEST-based joins, Structs, CTEs,  analytical functions...

Excuses first: I'm not super proud of the code and some technical/data modelling decisions, but, oh well, life.

Hope you can find it useful!",11,0,borjavb,2024-01-19 14:34:41,https://www.reddit.com/r/dataengineering/comments/19akgnq/bigquery_column_level_lineage_using_zetasql/,1,False,False,False,False
19aag3y,Interview prep with career gap,"I was laid off along with my entire team exactly a year ago while I was 9 months pregnant. I didn’t get the chance to study and do interviews with a newborn. Now i have a 11 month career gap in my resume. I have a total of 8.5 years of work exp mainly in AWS, snowflake, airflow. Also have done couple of years in the BI Domain with looker/ Quicksight. 
To those who are actively interviewing, how is the job market for experienced candidates? I am doing few Leetcode problems everyday but haven’t started applying yet.",10,2,trfgjd,2024-01-19 04:24:06,https://www.reddit.com/r/dataengineering/comments/19aag3y/interview_prep_with_career_gap/,0,False,False,False,False
199t56b,Addressing lack of cloud experience,"Hi everyone, 
Back again with another post. I recently had a bad interview experience where lack of cloud experience went against me. The fact that I had recently passed the google cloud professional data engineer exam didn't seem to have an impact, the recruiter said they needed someone with on hands experience on cloud. I am just tired of getting constantly rejected, it seems like every recruiter has a check list they are just trying to check everything off from. What can i do? Open to criticism.",11,18,afnan_shahid92,2024-01-18 15:48:35,https://www.reddit.com/r/dataengineering/comments/199t56b/addressing_lack_of_cloud_experience/,0,False,False,False,False
1971hmc,Interview prep help - Python,"Hello everyone,  
After browsing through the community posts, it seems like [neetcode.io](https://neetcode.io) is highly recommended for practising Python for Data Engineering (DE) interviews. I work as a Data Engineer at a small startup, and haven't studied for or practised LeetCode or Data Structures and Algorithms (DSA). Hence, I'm reaching out for guidance.  
In the [neetcode.io](https://neetcode.io) platform, the practice section allows you group questions by topic. I assume that some of these topics are more geared towards Software Development Engineer (SDE) interviews, and not all may be equally relevant to DE interviews.  
Could you share your priority list on which topics I should prioritise based on their relevance for DE interviews?  
A bit more context: My interview prep is not MAANG specific, the goal is to get good at basic problem solving that comes up in Python rounds.

  
The topics are:

1. Arrays and Hashing
2. Two Pointers
3. Sliding Window
4. Stack
5. Binary Search
6. Linked List
7. Trees
8. Tries
9. Heap / Priority Queue
10. Backtracking
11. Graphs
12. Advanced Graphs
13. 1-D dynamic programming
14. 2-D dynamic programming
15. Greedy
16. Intervals
17. Math & Geometry
18. Bit Manipulation

Thank you for the help!!",12,6,table_data,2024-01-15 05:55:32,https://www.reddit.com/r/dataengineering/comments/1971hmc/interview_prep_help_python/,0,False,False,False,False
1922n89,DuckDB as a data warehouse for multiple users?,"Have heard great things and wanted to give it a shot. Currently have a Postgres database handling data aggregations and ETL. I wanted to pick a separate technology for the warehouse so that down the road migrating to something like Snowflake would be less painful (no shortcuts, lazy coding, etc) and to keep end users from accidentally stalling out the resources of the ETL pipelines. Snowflake and anything similar would be overkill for my current data volume, and trying to avoid cloud for simplifying security environment.

I was curious how DuckDB could work in this scenario with multiple end users. The data in Postgres will be properly transformed into gold level and star schema before landing in the warehouse. I’m really wanting the warehouse to be a ready to consume analytics layer rather than a mess of transformations and staging tables (already using DBT in ETL pipelines).

Would I surface a common .db file on a local network for end users with read only access? Or is there another configuration to consider/another tool completely that would be better suited for the job.

Edit: thanks for all the replies. It seems like local data warehouse solutions meant for multiple users is in short supply. May use the Postgres columnar extension instead and use DuckDb as a backbone for superduperdb which seems more in spirit with the “embeddedness”",11,27,minormisgnomer,2024-01-09 01:46:42,https://www.reddit.com/r/dataengineering/comments/1922n89/duckdb_as_a_data_warehouse_for_multiple_users/,0,False,False,False,False
18xiu4l,Fastest Way to Read Excel in Python,,12,0,be_haki,2024-01-03 12:59:15,https://hakibenita.com/fast-excel-python,0,False,False,False,False
18vr5ja,Data Reconciliation in PySpark SQL,"Hello everyone. Just wanted some suggestions on the approach of how to do a data reconciliation between two tables.

Consider two tables as A and B. The table A contains 300 million records and table B also contains close to 300 million records. Now I want to do a data reconciliation in such a manner that it would find an exact match, a partial match and a no match from table A to B and vice versa. 

Since the data volume is so huge, I'm currently finding delta of A between yesterday vs today's record and then reconciling it with Table B (and vice versa). But I want to do a complete Reconciliation on a daily basis and for that I'm looking for a plan over here. I've a buffer time of 8-9 hours for completion of the job.

Any suggestions would be appreciated!!

Update: logic for exact match, partial match and no match.

So when it comes to comparison logic on high level, for an IP, if source, destination,port, and protocols matches exactly then that is an exact match. The logic of partial match is if any one of them does not matches keeping other fields matching then it's a partial match. And if none of them is matching then it's no match.
",11,17,AdQueasy6234,2024-01-01 06:54:26,https://www.reddit.com/r/dataengineering/comments/18vr5ja/data_reconciliation_in_pyspark_sql/,0,False,False,False,False
18tw6um,How to best sync files between Sharepoint and s3,"I am trying to let people upload excel files into Sharepoint that will be put into s3 and later into redshift. However having some difficulty. A few questions. 

&#x200B;

Do I want to use Lists or Libraries? 

How do I handle the creation, updates, and deletes? 

What happens if someone renames a file? Does a new file get created in s3 alongside the old one or does it actually replace it (seems unlikely?)

&#x200B;

Im basically thinking of creating 3 separate flows one for creates, one fore modifies, one for deletes. But Im not even sure if all 3 of those cases are supported. Any advice from someone who has done a similar thing would be very appreciated!",12,8,third_dude,2023-12-29 20:11:31,https://www.reddit.com/r/dataengineering/comments/18tw6um/how_to_best_sync_files_between_sharepoint_and_s3/,1,False,False,False,False
19f9s1r,"Why are foreign keys ""facts"" rather than ""dims""?","Filtering, grouping etc by foreign key is extremely common, which really suggests to me that they make more sense as dimensions for a particular object rather than 'facts', which generally have unique, high-info (a la shanon) data - that don't refer to other objects or tables.

Is there any good reason that in star/snowflake data warehouses foreign keys get put into fact tables instead? It seems illogical - but I'm probably just missing some crucial intuition here.",11,20,PangeanPrawn,2024-01-25 13:50:28,https://www.reddit.com/r/dataengineering/comments/19f9s1r/why_are_foreign_keys_facts_rather_than_dims/,0,False,False,False,False
19aui8e,When to unit test and when not to?,"I've read the main posts about unit testing on r/dataengineering. However, I am still confused about it.

How do I judge whether something requires a unit test or can be skipped?

The following is my train of thought and I can be completely off but yes trying to learn it more thru reddit. 

e.g I am curating a dataset with simple pandas transformations:

1. I read the dataset from the DL and rename the columns in a function in python e.g *read\_blabla\_and\_rename():* should i mock the data and test the renames? (i do it, but i find it silly)
2. Creating a function to add a fixed column *\_add\_hi\_column()* `df[""hi""] = ""bye""` => do I test this? because i see no purpose.
3. function to replace values where X and Y or Z is applicable => i surely test this because it contains actual logic that can go wrong.
4. Do i test a function that is just doing a left/inner merge?

....

I am also trying to follow a *as small as possible function approach,* it might be highly seen from a SWE POV but is it also a good thing to do for data cleansing/transformations functions?

&#x200B;

Any additional insights are highly appreciated :) 

&#x200B;",9,10,Jazzlike-Change8493,2024-01-19 21:37:16,https://www.reddit.com/r/dataengineering/comments/19aui8e/when_to_unit_test_and_when_not_to/,0,False,False,False,False
19aee11,"Switching from DE to management ( PO, PM, SM ...)","Have you ever thought to change from Data engineering to management ? 

I'm planning to make this move after 3 years in data engineering working with Databricks , Onprem tools and only on Azure cloud , in 2021 and 2022 I was getting way more offers but in 2023 it was very tough for me to have offers / interviews due to market situation. 

Do you think it's a good or bad move considering I invested a big amount of time learning DE? ",11,15,TProfessional,2024-01-19 08:27:01,https://www.reddit.com/r/dataengineering/comments/19aee11/switching_from_de_to_management_po_pm_sm/,1,False,False,False,False
1974haj,Netflix Creates Incremental Processing Solution Using Maestro and Apache Iceberg,,10,0,rgancarz,2024-01-15 09:07:49,https://www.infoq.com/news/2024/01/netflix-incremental-processing/,0,False,False,False,False
196ms9c,Need help in Spark streaming to address to delays when processing large batches,"Hello everyone,

I need help with Spark streaming in Databricks. I'm reading data from EventHub and writing it to a Delta Lake using the medallion architecture in two steps:

* EventHub to Bronze Delta table.
* Bronze to Silver Delta table (the final table).

The EventHub to Bronze part is working fine. However, when reading from Bronze to Silver (Delta to Delta), I'm facing issues. I'm using 1-second intervals to process batches, and sometimes I get a massive number of records in one batch (100,000 to 200,000), causing out-of-memory errors and delays.

I've tried adjusting parameters like maxRecordsPerTrigger, maxFilesPerTrigger, maxbytespertrigger  
, and Spark configurations like spark.databricks.delta.autoOptimize.optimizeWrite  
, spark.databricks.delta.properties.defaults.autoOptimize.autoCompact  
, and spark.sql.optimizer.dynamicPartitionPruning  
, along with enabling backpressure in streaming, but nothing seems to be working.

If I can limit the incoming records to around 15,000-20,000, it should solve the problem. Here are my questions:

1. Is there any other solution to this issue?
2. Is the approach of going from EventHub to Bronze and then Bronze to Silver the right one?
3. If I were to replace this flow with stream analytics, would it support complex transformations?  


attaching screeshots of code of reading from eventhub and writing the data to delta lake, also adding screenshot of  capturing the unexpected  data spike while transferring from Bronze to Silver, especially when there was no corresponding spike in EventHub data at that time 

please note: trigger\_time is 1 second

https://preview.redd.it/2ltlqx6hagcc1.png?width=868&format=png&auto=webp&s=0da2f9b413f7fa0689714e21d80fde30d5b39258

https://preview.redd.it/xiow507hagcc1.png?width=1113&format=png&auto=webp&s=a154da0f2546d2030e936eece7ca690f9f281cfc

https://preview.redd.it/yv0yg27hagcc1.png?width=1204&format=png&auto=webp&s=c475dd3ad360e569488b85d204f5d93865dedc9a",10,11,HousingStriking3770,2024-01-14 18:40:52,https://www.reddit.com/r/dataengineering/comments/196ms9c/need_help_in_spark_streaming_to_address_to_delays/,0,False,False,False,False
196hvq8,Newbie here trying to learn,"Hi, I recently started a new job that is not related to data engineering, but there are a lot of things where I can apply ETL things to automate my tasks. I don't have experience as a data engineer but is my goal to switch careers and get a data engineering job eventually.

Anyways, my problem is as follows: Everyday I get a new CSV that is the same table as the day before but with new info. Every day I need to rearrange that table and 1- create a new CSV file with the daily info and 2-  ""append"" it into the monthly cleaned table. 

Those things that take a lot of time manually I can use python to automate the task, and I am in the process of achieving it. But the thing is that I get to a point in which I don't know if I should use stuff like SQLalchemy, psycopg2 or if I should just stick to pandas. I want to understand the thought process of when I should use what. Let me develop. 

For example, once I get the CSV as a DF, I filter it with pandas. But then, I need to modify the values of column F according to the values of column G. In column G I have description and each description corresponds to a group. In column F I need to specify the group. I know I can keep using pandas to also achieve this, but at the same time, this is a clear and plain simple JOIN function. 

I am reluctant to create a, let's say, PostgreSQL Database because I want to eventually be able to share my python scripts as an exe and someone like my teammate can simply execute it and don't need another program like PostgreSQL to successfully run the file. But maybe I should just do it. I don't really know. 

Also I don't understand why should I use sql at all if pandas can cover for the things that I want to achieve. 

Thanks in advance for your advice and if you can point me into maybe some useful learning books I would really appreciate it.",10,28,GFM41,2024-01-14 15:07:06,https://www.reddit.com/r/dataengineering/comments/196hvq8/newbie_here_trying_to_learn/,0,False,False,False,False
192ou1k,How are people orchestrating the T in ELT for their data warehouses?,"This is probably a stupid question to anyone with a deeper background in data engineering, but I'm new and learned dbt first using dbt cloud which makes orchestrating transformation pretty easy. 

If I have a data warehouse and I can't use dbt, how do I go about orchestrating transformation of data after landing it in raw form in the data warehouse? BigQuery seems to have Dataform and I'm guessing the other cloud providers have something similar, but what if I'm just using an on-prem database? Do I just have a bunch of scheduled stored procedures?",10,10,PureOhms,2024-01-09 20:34:53,https://www.reddit.com/r/dataengineering/comments/192ou1k/how_are_people_orchestrating_the_t_in_elt_for/,1,False,False,False,False
1927hdr,(Data) Engineering Managers - What Makes You Stay At A Company Long,"I am currently working with a large insurance company as a consultant where they have adopted data mesh. Almost every application team uses DW + dbt core. All of this is facilitated by a 10 member data platform squad. The guy heading the team is a gun - although an engineering manager engaging constantly with stakeholders, vendors, being on top of the data security game and still finds enough time to deploy some dbt models and setup some python automations. 

&#x200B;

My question is: What makes a person who is clearly able to talk both business and tech stay at a company - the company isn't a super flashy company and tends to keep in the shadows but he has been there for 15 years? Are such pivotal employees managing key business units in large enterprises constantly rewarded with monetary benefits? Do these enterprises regularly catchup with them to ask them ""Are you happy here? If not, what can we do to make it better?"" questions. Although total within their rights, they probably have a understanding how them leaving the company would impact a large enterprise and I guess here building a really strong squad during the tenure is important. 

&#x200B;",11,7,Outrageous_Apple_420,2024-01-09 05:48:16,https://www.reddit.com/r/dataengineering/comments/1927hdr/data_engineering_managers_what_makes_you_stay_at/,1,False,False,False,False
