id,title,selftext,score,num_comments,author,created_utc,url,upvote_ratio,over_18,edited,spoiler,stickied
1abnlf1,Data analyst to data/ML engineer?,"I'm so lucky, I landed my first full time analyst job at my dream company (large healthcare system). The pay isnt great, but the benefits and work/life balance are incredible. I now realize it's a great place to work if you're settling down, not so great if you're looking to move up the ladder in your mid 20s. 

I do a mix of ETL scripting (pandas, sqlalchemy, pyodbc) and mundane accounting with Excel. 

I originally had aspirations of landing a data engineering role 1-2 yrs later, but I think I would want ML engineer roles instead. I want to go into risk analytics for health insurance/healthcare systems, there's a lot of opportunities to use advanced stats and ML there. The data I currently work with doesn't have any clinical info to determine risk, so I'm limited to data engineering tasks. I also want to be more involved in delivering business insights, rather than strictly backend data stuff. 

Any ML engineers or data engineers here to share their thoughts?",3,0,velimino,2024-01-26 17:19:45,https://www.reddit.com/r/dataengineering/comments/1abnlf1/data_analyst_to_dataml_engineer/,0,False,False,False,False
19fgexg,How to transition from GUI DE to more modern stack?,"Background: I have a degree in mechanical engineering and have 2 years under my belt as a Business Intelligence developer on a ETL team. We mostly use Informatica and SQL server. I have got a certification with Azure DE associate but no projects at work.

I’d like to transition to a role with more modern/cloud tools. My end goal is to be a ML engineer. I am considering doing GT or UIUC masters in CS. But for now, what are some tips to make you more competitive for roles with modern tooling when you only have experience with Informatica/on-prem architecture? Any tips on resume or things I can do to stand out?",3,9,putt_stuff98,2024-01-25 18:40:38,https://www.reddit.com/r/dataengineering/comments/19fgexg/how_to_transition_from_gui_de_to_more_modern_stack/,0,False,False,False,False
19fbd0n,Why would anyone pick Cloudera Data Platform over Amazon EMR?,We're moving our workloads to the public cloud and honestly I cannot think of a single advantage of using CDP over EMR. Has anyone had any experience with this? Does anyone have any good reasons to stick with the Cloudera offering? Also Cloudera sound like they're way behind on everything when it comes to the Cloud. Databricks at least promises proprietary optimizations to Spark but Cloudera offers nothing that EMR or Databricks already do better.,3,11,oontkima,2024-01-25 15:04:13,https://www.reddit.com/r/dataengineering/comments/19fbd0n/why_would_anyone_pick_cloudera_data_platform_over/,1,False,False,False,False
19faisc,Deltalake using Azure Synapse Analytics/Workspace is good?? Please advice,"
hey all.. I understand Databricks is the best choice when it comes to these Deltalake jargon.. But bear with me, in this case I'll only focus on Synapse.

Current situation, using Synapse Pipeline for Orchestration and Ingestion from source (copy activity), then data transformation using Spark Pool with pyspark.. Result is in delta table format.. Now questions:

1. I noticed in dbricks we have SQL Endpoint that able to connect PBI to adls delta table.. Similar things non-existent in Synapse? Do we really need to push data to Dedicated pool to be able to use these data in PBI? If so, what's the point to have uncosumable delta table in Synapse?

2. Have heated args with colleague about whether compute in Spark Pool (coding + sql) vs Dedicated Pool (pure SQL StoredProc styles).. I'm not a big fan of Datalake with dwh-table styles, as datalake should be an open table format which can help user with so many possiblities such as ML/AI, programming-styles development, sql-styles development, etc.. Not only limiting people with sql. Then we can build dwh on top of Datalake (like gold layer or whatever those jargons are).. Proof me if I was wrong? 

fyi we have 3 big ERP as sources, such as: Oracle & SAP.. Multiple DBs and Hundreds of tables as sources..",4,12,BumbleBeeBumbleBoo,2024-01-25 14:25:55,https://www.reddit.com/r/dataengineering/comments/19faisc/deltalake_using_azure_synapse_analyticsworkspace/,0,False,False,False,False
19erzhn,What courses or certificates are intresting to get as junior?,"I'm a junior with 1.5 years of experience, and I generally enjoy my assignments. While the work can be challenging at times, I believe it's an integral part of learning in the IT sector. We have a solid stack and strive to incorporate good practices whenever possible. Our team also utilizes some specific technologies.

I recently inquired with my supervisors about potential next steps, and they suggested gaining more experience before pursuing additional AWS certifications (I currently hold 2). Fortunately, I have the flexibility to attend relevant courses or events, with the company covering the associated costs.

For those with more experience, could you please suggest worthwhile investments of time and money that align with career growth in the data engineering field?",3,4,Warper27,2024-01-24 21:34:17,https://www.reddit.com/r/dataengineering/comments/19erzhn/what_courses_or_certificates_are_intresting_to/,0,False,False,False,False
19eqaen,tools to query s3 compatible on-prem object stores,"I'm looking for tools/framework to query s3 compatible object data stores hosted on prem. I know trino/presto can provide sql layer on top of object storage, are there any other simple and efficient tools available?",3,2,przx2,2024-01-24 20:24:44,https://www.reddit.com/r/dataengineering/comments/19eqaen/tools_to_query_s3_compatible_onprem_object_stores/,1,False,False,False,False
19edyrx,Apache Superset: Percentages and Pivot table with heatmap,"Hello everyone, i have some questions for you about Apache Superset.

  
The my first doubt is how to use percentages in the tool. I'll explain it better: basically i'm trying to values in a bar chart in percentages instead of values (the total being the sum of values).

My second doubt instead is on displaying data from a pivot table into a heatmap. Basically, since i nedd rows from the table to be values on the Y axis i need to transform my data by using a pivot table, but i'm unable to use that transformed data into my heatmap, so i'd need to use custom SQL queries, which i'd like to avoid.

Thanks",3,1,Disastrous-Tune2889,2024-01-24 10:22:23,https://www.reddit.com/r/dataengineering/comments/19edyrx/apache_superset_percentages_and_pivot_table_with/,1,False,False,False,False
19ebd3a,Which is the way-to-go database for Data Science applications,"A newbie here, so please, have mercy.

I am just trying to migrate from the amateur `pickle` and `numpy.save()` to a db-based approach for my Data Science projects. However, I have no idea which db I should start. What would be your advice?",2,5,Puzzleheaded_Egg_184,2024-01-24 07:13:29,https://www.reddit.com/r/dataengineering/comments/19ebd3a/which_is_the_waytogo_database_for_data_science/,0,False,False,False,False
19e7pf8,Must watch if you have ever been confused/frustrated with Python paths and packaging.,,4,0,mjgcfb,2024-01-24 03:40:32,https://www.youtube.com/watch?v=v6tALyc4C10,1,False,False,False,False
19e2m1m,How would you do it? Make my plan better.,"So I'm currently doing Masters in Ai and Data and I don't have a CS bachelor degree not even related to it. It's in Finance/Business. 

I have a few months till I graduate. I have had few projects using Python, I'm familiar with SQL. I know I need to get better at both of them. 

I also wanted to do the Microsoft DP-203 and the AWS Data Engineer Associate / Solution Architect. 1. To fill cv and 2. To be familiar with cloud. 

What else should I spend the next few months doing? And do I have a chance at landing my first job soon or no? Is this enough or not? 

I'm in London (UK) if that helps.",3,4,Timeframe98,2024-01-23 23:37:51,https://www.reddit.com/r/dataengineering/comments/19e2m1m/how_would_you_do_it_make_my_plan_better/,1,False,False,False,False
19dor5g,How do you decide on resource sizes?,I'm trying to figure out how to size resources for our data pipeline and warehouse. My boss wants me to calculate what each pipeline needs in terms of compute and RAM. Any ideas on how to evaluate and track these requirements? Would love to hear what's worked for you.,3,5,Kindly-Screen-2557,2024-01-23 13:45:40,https://www.reddit.com/r/dataengineering/comments/19dor5g/how_do_you_decide_on_resource_sizes/,1,False,False,False,False
19dmm6t,Data Vault or Dimensional Modelling?,"Hi,

I am working on data engineering project, and am thinking what data modelling technique to use? Can someone give a suggestion?

Thank you very much for reading and helping.",3,3,Aggressive-Nebula-44,2024-01-23 11:45:55,https://www.reddit.com/r/dataengineering/comments/19dmm6t/data_vault_or_dimensional_modelling/,0,False,False,False,False
19djcsf,New player to the game,"I recently started as a Data Analyst after a career change. As with many others, I was quickly identified as a candidate for a JDE role. Ever since (~2 months) I have been mainly working with spatial data in FME and handling pipelines and dashboards.

My organization have suggested I take some training on spatial data, but I also want to know where else I can apply myself to progress becoming a Data Engineer. Any tips on specific skills, certifications, or experiences that could help me? I'd say I have moderate ability with SQL and basic Python understanding. Should I be putting all my time in data handling / manipulation in Python? Should I be looking at any other ETL tools (we currently use FME exclusively). Should I be considering database managent?? 

Any help and advice is really appreciated!",3,1,BrittleTupperwareBox,2024-01-23 07:57:46,https://www.reddit.com/r/dataengineering/comments/19djcsf/new_player_to_the_game/,0,False,False,False,False
19cq4gk,How to structure a data pipeline repo for pyspark jupyter notebooks?,"I am planning to build a data pipeline for a new project, which would be in pyspark sagemaker notebooks Technologies used as below
Orchestration: Airlfow
Storage: S3
Final transformed tables will be created in athena.

How would you structure a git repo that's written in pyspark notebooks and with a dag folder. We are also looking to implement CI/CD in the future.

Would like to hear all your suggestions and any github repo examples would be highly appreciated.
 Thanks!",3,0,arunrajan96,2024-01-22 07:23:39,https://www.reddit.com/r/dataengineering/comments/19cq4gk/how_to_structure_a_data_pipeline_repo_for_pyspark/,1,False,False,False,False
19cpy1e,GCP Professional Data Engineer new pattern,"I've scheduled my GCP PDE exam for 30th Jan, but heard that Google has significantly changed the exam pattern in November. Has anybody appeared for the exam after the pattern change? Are there any dumps available as per the new pattern? What new topics should I focus on for the exam?",3,1,bashed_it,2024-01-22 07:11:15,https://www.reddit.com/r/dataengineering/comments/19cpy1e/gcp_professional_data_engineer_new_pattern/,1,False,False,False,False
19c3sst,How valuable are Certifications?,"I have the Databricks ML / DE Professional Certifications.

I'm currently a DE wanting to move to a better (higher paying) DE position or an MLE position. How are the certifications regarded by the companies, especially at FAANG? If they are not that well regarded, what else should I be focusing on to transition to an MLE position?",3,8,asozers,2024-01-21 13:49:25,https://www.reddit.com/r/dataengineering/comments/19c3sst/how_valuable_are_certifications/,0,False,False,False,False
19bb6ru,parallel ingestion in snowflake!?,"In on of my project, I have  a stored procedure in snowflake that is generating ingestion query of around 100 raw files into around 20 tables. Right now we are using sample Data, each one has few thousands rows. And ingestion time is around 10 minutes. 
But i m sure in production environment each file will contain millions of rows any my estimate is that will takes 30 minutes to ingest. 

Right now, I am running all ingestions queries in sequential manner, one by one. But I want to ingest Data parallely in asynchronous manner/Mutlithreading whichone is the right term, I have no idea. 
Inside snowflake, I m using python which has features to do parallel processing. But is it possible to do so in snowflake. Or any theoritical modification, you are thinking to suggest. 

From business perspective it's not necessary, since these are DWH layer and processing is of batch type. I m just exploring probable options from learning perspective. 

Thanks in advance. Any lead will be appreciated.",3,20,asud_w_asud,2024-01-20 12:56:27,https://www.reddit.com/r/dataengineering/comments/19bb6ru/parallel_ingestion_in_snowflake/,0,False,False,False,False
19b8e6v,Job title... What do you think?,"Hey all, quick question.

I've been a DE roughly 3 years and just applied to a senior DE role at a consultancy and was pleasantly surprised to get offered the role. Hurrah.

Anyway I received the contract and the title was technical project manager. I love being a data engineer and I don't want to not be close to the code or etl. In your experience if some one had technical project manager on their cv would you discount that as DE experience? Or are the roles synonymous?

Thanks",3,5,tcfcfc,2024-01-20 09:53:20,https://www.reddit.com/r/dataengineering/comments/19b8e6v/job_title_what_do_you_think/,1,False,False,False,False
19aq5eh,Origins of NumPy by its creator Travis Oliphant,,3,0,dnulcon,2024-01-19 18:35:46,https://youtu.be/nnPAAMbUWAM?si=cn3KFUIuNE0hxDSw,0,False,False,False,False
19ap18l,Piecing together sessions to analyze online user activity,,2,0,JanethL,2024-01-19 17:50:10,https://www.youtube.com/watch?v=T94zNPW-Meo,0,False,False,False,False
19aeowz,Do you think Data Engineers should have point solutions for Data Observability and Catalog OR prefer a consolidated solution which is seamlessly integrated?,"Speaking to peers, few teams have deployed data - catalog already , however from Data Observability perspective having a different tool can be cumbersome since both talk to each other.  
   
Let me know what you think?  
I am comparing: GE + Open-Metadata, decube.io (its unified), Atlan + MC",3,2,de4all,2024-01-19 08:48:45,https://www.reddit.com/r/dataengineering/comments/19aeowz/do_you_think_data_engineers_should_have_point/,1,False,False,False,False
19a7tnt,Seeking Advice to Enhance Data Engineering Pipeline,"Hello fellow data enthusiasts! 👋

 I recently joined a government organization as a data analyst on the business side, and a significant part of my role involves writing Python scripts for ETL processes. I'd love to get your insights and advice on how I can level up my data engineering pipeline, as I'm keen on enhancing efficiency and exploring new possibilities. 

**Current Setup:**

* Our primary data resides in an Oracle environment (Production Repo)
* I've developed several Python scripts to extract, transform, and load data from the production repo to our SQL Server data warehouse.
* The ETL scripts are scheduled to run daily using .bat scripts on Windows Task Scheduler, and I diligently maintain logs for transparency and troubleshooting.
* To handle data from external sources (like Vendor portals), I've implemented Selenium scripts, also scheduled for daily execution. These scripts fetch data from the portals and load it into our SQL Server data warehouse.
* For real-time data needs, I've created Power BI dashboard reports connected to our data warehouse via the company gateway. These reports refresh daily, providing up-to-date insights.

**Current Development Environment:**

* Operating on a Windows virtual machine.

**Seeking Advice:** 

In addition to my current setup, I initially aimed to enhance my data engineering pipeline further by:

* Installing Windows Subsystem for Linux (WSL) on my Windows server.
* Scheduling scripts using cron tabs from a Docker container.
* Exploring the use of PySpark for data transformations to optimize script run time.

However, I've hit a roadblock – the IT team has informed me that I can't install WSL on the Windows machine due to virtualization restrictions. Now, I'm contemplating my next steps and would love your insights? ",3,10,tragediest,2024-01-19 02:11:27,https://www.reddit.com/r/dataengineering/comments/19a7tnt/seeking_advice_to_enhance_data_engineering/,1,False,False,False,False
199wj94,Importance of Dynamic Programming and Graphs in DE Interviews,"For those who have undergone multiple interviews in their careers, how frequently were you asked questions related to Dynamic Programming and Graphs? I'm interested in understanding the prevalence of these topics in the interview process. Feel free to share your insights and experience.
Thanks!",3,1,PunctuallyExcellent,2024-01-18 18:10:39,https://www.reddit.com/r/dataengineering/comments/199wj94/importance_of_dynamic_programming_and_graphs_in/,1,False,False,False,False
199oy12,Career shift planning advice (Software Eng to DevOps/SRE to Data Eng?),"I'm a software developer in a developing country. I've been working remotely for American companies for the past 8.5 years as a software engineer, but kind of in a niche industry that over the years I've grown to really dislike - so I've been thinking of switching industries for a while now. My main work line is in PHP/Javascript and I've been slowly but steadily moving further to the back-end, trying to get more work in the CI/CD pipelines, data modeling, database management and such.

Within the companies I've worked for, I've become known for being one of only people around who understands data/databases/search in a deeper way and I got a great deal of exposure to both MySQL, Elastic stack and Redis. I do have an Elastic Engineer certification and a fair amount of knowledge of Bash/Python, Linux, DevOps, CI, containers and such, but no real on-the-job experience with distributed computing/data tools.

Early last year I got laid off and started applying for DE jobs, but in the era of ATS I didn't land a single interview in this area and ended up taking another job in the same industry (a good one, at least).

I've been around the block and I'm very confident in my ability to learn quickly on the job but I'm now 40 and I have two kids and a career, which means my time for on-the-side projects is really limited and I can't take a dip in salary to start over as a junior (though mostly because of location, my salary isn't really that high, I'm currently at 90k).

If you were in my shoes, how would you go about trying to land a DE job? Do you think routing through DevOps/SRE could be a good alternative?",3,1,Time_Simple_3250,2024-01-18 12:22:11,https://www.reddit.com/r/dataengineering/comments/199oy12/career_shift_planning_advice_software_eng_to/,1,False,False,False,False
199hke6,Unstructured data,"I feel in the next few years solutions will come out to do analysis on more unstructured data (no not just log files), I mean video, audio, text and doing sentiment analysis on it to extract data and do data quality check to train a LLM

Anyone doing this in their current data engineering job? Any tech stacks to do this that you recommend?",3,3,Guilty-Commission435,2024-01-18 04:31:03,https://www.reddit.com/r/dataengineering/comments/199hke6/unstructured_data/,1,False,False,False,False
1998e1x,SSH Tunneling for Secure Postgres Replication,"At [PeerDB](https://peerdb.io/), we recently added this new feature of SSH Tunneling to securely connect and replicate data from your Postgres Database to Data Warehouses. Sharing the blog that talks more about this feature - [https://blog.peerdb.io/ssh-tunneling-for-secure-postgres-replication](https://blog.peerdb.io/ssh-tunneling-for-secure-postgres-replication) We would love to hear your feedback!  


https://i.redd.it/988cru7ik2dc1.gif",3,0,saipeerdb,2024-01-17 21:31:39,https://www.reddit.com/r/dataengineering/comments/1998e1x/ssh_tunneling_for_secure_postgres_replication/,1,False,False,False,False
1994v41,Reconsidering an Interview Opportunity After Initial Rejection: Seeking Advice on Whether to Proceed,"I applied for a DE position at a major financial services company, and after the initial interview, they chose another candidate. Two months later, the job was reposted, and somewhat impulsively, I reapplied. Now, I've been contacted for another interview. I'm uncertain about proceeding because I fear the initial panel's opinion might not have changed. Would it be advisable to call and cancel the interview?",4,10,Greckol,2024-01-17 19:12:00,https://www.reddit.com/r/dataengineering/comments/1994v41/reconsidering_an_interview_opportunity_after/,0,False,False,False,False
1992yx6,One billion row challenge - Dask vs. Spark,"I was inspired by the [unofficial Python submission to the 1BRC](https://github.com/gunnarmorling/1brc/discussions/62) and wanted to share an implementation for Dask and PySpark: [https://github.com/gunnarmorling/1brc/discussions/450](https://github.com/gunnarmorling/1brc/discussions/450)  
Dask took \~32 seconds, while Spark took \~2 minutes.

Amongst the other 1BRC Python submissions, Dask is pretty squarely in the middle. It’s faster than Python’s multiprocessing (except for the PyPy3 implementation) and slower than DuckDB and Polars. This is not too surprising given Polars and DuckDB tend to be faster than Dask on a smaller scale, especially on a single machine. I was actually pleasantly surprised to see this level of performance for Dask on a single machine for only a 13 GB dataset. This is largely due to a number of recent improvements in Dask like:  
\- Arrow strings  
\- New shuffling algorithms  
\- Query optimization  


Though many of these improvements are still under active development in the dask-expr project, Dask users can expect to see these changes in core Dask DataFrame soon.  


More details in this blog post: [https://blog.coiled.io/blog/1brc.html](https://blog.coiled.io/blog/1brc.html)",3,1,dask-jeeves,2024-01-17 17:57:22,https://www.reddit.com/r/dataengineering/comments/1992yx6/one_billion_row_challenge_dask_vs_spark/,1,False,False,False,False
1991uni,Intro to SQL Indexes,,3,0,dataengineeringdude,2024-01-17 17:14:08,https://dataengineeringcentral.substack.com/p/intro-to-sql-indexes,0,False,False,False,False
19892yb,Choicing beetween DE vs DS,"Why starting as a DE might be better than DS, considering maybe going to MLE in the future? I like the DE area and I think maybe strong skills like a DE combined with enough DS could be the key and could it be that DE will be more valued in the future as DS is today?",3,4,M4loka,2024-01-16 17:53:10,https://www.reddit.com/r/dataengineering/comments/19892yb/choicing_beetween_de_vs_ds/,0,False,False,False,False
19863jk,Network route visualization using pyvista and osmnx,"&#x200B;

[Network route visualization using pyvista and osmnx](https://preview.redd.it/q0n4jfveqtcc1.png?width=1357&format=png&auto=webp&s=ba5fa1ca2de8fece3098c795d168d5dd5a9d1343)

[Network route visualization using pyvista and osmnx](https://spatial-dev.guru/2024/01/14/network-route-visualization-using-pyvista-and-osmnx/)",3,0,iamgeoknight,2024-01-16 15:53:19,https://www.reddit.com/r/dataengineering/comments/19863jk/network_route_visualization_using_pyvista_and/,1,False,False,False,False
197sqkq,[Advice] - Computer Science Degree,"I'm currently in honey moon with de (maybe some of you been here idk) and also in the final year of my Bachelor's degree in Civil Engineering. Started working as a Data Engineer in a startup, and this experience has sparked a serious interest in computer science for me. I'm thinking about pursuing a degree in Computer Science after I graduate. From what I've looked into, it would take me about two more years to complete, which means I'd have dual degrees in Civil Engineering and Computer Science by 2026.

I seek for advice, will I be wasting my time?",3,4,gabiru97,2024-01-16 03:27:54,https://www.reddit.com/r/dataengineering/comments/197sqkq/advice_computer_science_degree/,0,False,False,False,False
197rzuz,Centralized Metrics in DWH,"We have built a data warehouse in Snowflake for whole department . There are certain key metrics that we want to produce and control the definition to maintain consistency of those numbers across the organization.
I don’t want to store only aggregated numbers, as it will lose slicing/dicing ability. I want to create a generic framework that we can use for new metrics too.
What kind of framework or approach have you guys used or recommend for such use case?
TIA",3,1,discoveringlifeat39,2024-01-16 02:51:30,https://www.reddit.com/r/dataengineering/comments/197rzuz/centralized_metrics_in_dwh/,1,False,False,False,False
1977b3s,Interview pattern for data engineers in product based companies?,"Hello, I am planning to switch in 8-12 months. Currently working in telecom based company in gcp services. I want to know interview pattern for data engineers in good product based companies like below.
Altassian
PepsiCo
Gojek
Wallmart
Intuit
BP
Same level companies.

1. No of rounds?
2. Is DSA involved?
3. Coding round on which language.

Please share your experience. It will help a lot.",4,1,TheErenYeager03,2024-01-15 12:11:06,https://www.reddit.com/r/dataengineering/comments/1977b3s/interview_pattern_for_data_engineers_in_product/,0,False,False,False,False
